{
    "typefield": "file",
    "platform": "OneDrive",
    "id": "1617054500111",
    "timestamp": "2021-03-29T23:58:20.111Z",
    "content": {
      "fileName": "Slack_sdk.pdf",
      "fileLocation": "http://localhost:9000/slack-attachments/0/F090HD77CJK_Slack%20sdk.pdf?X-Amz-Algorithm=AWS4-HMAC-SHA256&X-Amz-Credential=admin%2F20250612%2Fus-east-1%2Fs3%2Faws4_request&X-Amz-Date=20250612T103527Z&X-Amz-Expires=3600&X-Amz-SignedHeaders=host&X-Amz-Signature=35461665ab37f4cecad8021a77b55c8d987ddca08d04a72ab24c83a1db90ec2a"
    }
  }
